{
  "$schema": "./env.registry.schema.json",
  "version": "phase9d-did-primary-heygen-secondary-v1",
  "repo": "west-peek-pitch-lab",
  "sourceOfTruth": "config/env.registry.json plus encrypted secrets/pitch-lab.env.vault.enc",
  "rules": {
    "localEnvFile": ".env.local",
    "encryptedVaultFile": "secrets/pitch-lab.env.vault.enc",
    "decryptedVaultFileForbidden": "secrets/pitch-lab.env.vault.json",
    "cloudflareSyncMode": "dry-run-by-default",
    "realSecretValuesInRepo": false,
    "lowestCostV1": "Cloudflare free + Gemini/OpenAI text + D-ID primary / HeyGen secondary talking avatar video for key moments.",
    "avatarPolicy": "D-ID is primary for MVP talking-avatar video. HeyGen is secondary fallback. ElevenLabs remains voice-only support and is not treated as a native talking-photo video provider.",
    "voicePolicy": "Avatar provider-owned voice is preferred for video simplicity; ElevenLabs voice remains available only for voice-only proof or explicit audio_url flows.",
    "llmPolicy": "Gemini-first server-side LLM path with OpenAI as cheapest enabled fallback; no client-side secrets; unavailable providers return honest failure without placeholder AI output.",
    "llmFallbackPolicy": "Default order is Gemini primary then OpenAI fallback when LLM_FALLBACK_ENABLED=true and LLM_ROUTING_MODE=lowest_cost_available.",
    "scooterWisdomPolicy": "Scooter Wisdom is a non-optional product invariant. The single source is content/scooter-wisdom/approved/approved-wisdom.json; there is no env layer, no mode switch, and no on/off toggle.",
    "currentImplementedPhase": "phase9d",
    "cloudflarePlanPolicy": "Default Cloudflare plan includes only non-local app runtime variables through currentImplementedPhase. Future-phase variables require --through-phase or --all. Local deploy/vault tooling variables are never pushed to the app runtime.",
    "phase6ProviderPolicy": "Superseded by Phase 9D: D-ID primary and HeyGen secondary for talking avatar video; key moments are welcome, final personalized summary, and share/close. Text-only/static is degraded mode, not intended experience.",
    "mediaIdentityPolicy": "Scooter photo and non-secret provider IDs are repo identity assets. API keys and webhook secrets remain env/vault only. Official Scooter photo lives at public/assets/avatar/scooter-avatar-source.png.",
    "phase9dProviderPolicy": "Talking AI Scooter is core. D-ID is the first provider for MVP talking-avatar video and HeyGen is secondary. Env values remain encrypted/vault-only until provided.",
    "phase9dProviderProofPolicy": "Talking-avatar MVP media is not complete until D-ID primary or HeyGen secondary returns a real queued/rendered clip for welcome/final/share moments."
  },
  "variables": [
    {
      "key": "APP_ENV",
      "requiredPhase": "phase2",
      "scope": "public_config",
      "cloudflareBinding": "plain_var",
      "clientExposure": "allowed",
      "placeholder": "development",
      "description": "Runtime environment label.",
      "productionExample": "production"
    },
    {
      "key": "APP_BASE_URL",
      "requiredPhase": "phase2",
      "scope": "public_config",
      "cloudflareBinding": "plain_var",
      "clientExposure": "allowed",
      "placeholder": "http://localhost:5173",
      "description": "Canonical app base URL used by server routes and redirects.",
      "productionExample": "https://pitchlab.joinwestpeek.com"
    },
    {
      "key": "PUBLIC_APP_URL",
      "requiredPhase": "phase2",
      "scope": "public_config",
      "cloudflareBinding": "plain_var",
      "clientExposure": "allowed",
      "placeholder": "http://localhost:5173",
      "description": "Public Pitch Lab URL shown or linked from public UI.",
      "productionExample": "https://pitchlab.joinwestpeek.com"
    },
    {
      "key": "LLM_PROVIDER",
      "requiredPhase": "phase4",
      "scope": "server_config",
      "cloudflareBinding": "plain_var",
      "clientExposure": "forbidden",
      "placeholder": "gemini",
      "description": "Selected LLM provider. V1 default is Gemini for lowest-cost/free-tier path."
    },
    {
      "key": "GEMINI_API_KEY",
      "requiredPhase": "phase4",
      "scope": "server_secret",
      "cloudflareBinding": "secret",
      "clientExposure": "forbidden",
      "placeholder": "REPLACE_WITH_LOCAL_GEMINI_API_KEY",
      "description": "Gemini API key for V1 low-cost LLM path."
    },
    {
      "key": "GEMINI_MODEL",
      "requiredPhase": "phase4",
      "scope": "server_config",
      "cloudflareBinding": "plain_var",
      "clientExposure": "forbidden",
      "placeholder": "gemini-2.5-flash",
      "description": "Gemini model name for pitch critique and Pitch Story Card generation."
    },
    {
      "key": "GEMINI_API_BASE_URL",
      "requiredPhase": "phase4",
      "scope": "server_config",
      "cloudflareBinding": "plain_var",
      "clientExposure": "forbidden",
      "placeholder": "https://generativelanguage.googleapis.com",
      "description": "Gemini API base URL."
    },
    {
      "key": "LLM_TIMEOUT_MS",
      "requiredPhase": "phase4",
      "scope": "server_config",
      "cloudflareBinding": "plain_var",
      "clientExposure": "forbidden",
      "placeholder": "30000",
      "description": "Maximum server-side LLM request duration before failing safely."
    },
    {
      "key": "LLM_MAX_INPUT_CHARS",
      "requiredPhase": "phase4",
      "scope": "server_config",
      "cloudflareBinding": "plain_var",
      "clientExposure": "forbidden",
      "placeholder": "12000",
      "description": "Maximum combined founder input characters accepted by AI endpoints."
    },
    {
      "key": "LLM_MAX_OUTPUT_TOKENS",
      "requiredPhase": "phase4",
      "scope": "server_config",
      "cloudflareBinding": "plain_var",
      "clientExposure": "forbidden",
      "placeholder": "2200",
      "description": "Cost-aware output token cap for pitch critique, Story Card, and final Scooter script generation."
    },
    {
      "key": "LLM_FALLBACK_ENABLED",
      "requiredPhase": "phase4",
      "scope": "server_config",
      "cloudflareBinding": "plain_var",
      "clientExposure": "forbidden",
      "placeholder": "true",
      "description": "Enables server-side LLM fallback routing after the primary provider fails safely."
    },
    {
      "key": "LLM_FALLBACK_PROVIDER",
      "requiredPhase": "phase4",
      "scope": "server_config",
      "cloudflareBinding": "plain_var",
      "clientExposure": "forbidden",
      "placeholder": "openai",
      "description": "Lowest-cost first fallback provider after Gemini. Default fallback is OpenAI."
    },
    {
      "key": "LLM_ROUTING_MODE",
      "requiredPhase": "phase4",
      "scope": "server_config",
      "cloudflareBinding": "plain_var",
      "clientExposure": "forbidden",
      "placeholder": "lowest_cost_available",
      "description": "LLM routing mode. Defaults to lowest-cost available provider order: Gemini then OpenAI fallback."
    },
    {
      "key": "OPENAI_API_KEY",
      "requiredPhase": "phase4",
      "scope": "server_secret",
      "cloudflareBinding": "secret",
      "clientExposure": "forbidden",
      "placeholder": "DISABLED_UNLESS_OPENAI_FALLBACK_CONFIGURED",
      "description": "OpenAI API key used only for server-side LLM fallback when enabled and configured."
    },
    {
      "key": "OPENAI_MODEL",
      "requiredPhase": "phase4",
      "scope": "server_config",
      "cloudflareBinding": "plain_var",
      "clientExposure": "forbidden",
      "placeholder": "gpt-4.1-mini",
      "description": "OpenAI fallback model. Start with mini for quality/cost balance; test nano only after quality proof."
    },
    {
      "key": "OPENAI_API_BASE_URL",
      "requiredPhase": "phase4",
      "scope": "server_config",
      "cloudflareBinding": "plain_var",
      "clientExposure": "forbidden",
      "placeholder": "https://api.openai.com",
      "description": "OpenAI API base URL for fallback provider."
    },
    {
      "key": "OPENAI_TIMEOUT_MS",
      "requiredPhase": "phase4",
      "scope": "server_config",
      "cloudflareBinding": "plain_var",
      "clientExposure": "forbidden",
      "placeholder": "30000",
      "description": "OpenAI fallback request timeout before failing safely."
    },
    {
      "key": "OPENAI_MAX_OUTPUT_TOKENS",
      "requiredPhase": "phase4",
      "scope": "server_config",
      "cloudflareBinding": "plain_var",
      "clientExposure": "forbidden",
      "placeholder": "2200",
      "description": "Cost-aware output token cap for pitch critique, Story Card, and final Scooter script generation."
    },
    {
      "key": "VOICE_PROVIDER",
      "requiredPhase": "phase9d",
      "scope": "server_config",
      "cloudflareBinding": "plain_var",
      "clientExposure": "forbidden",
      "placeholder": "fish_audio",
      "description": "Voice provider for dynamic Scooter speech. Fish Audio is primary after cloning the uploaded Scooter voice sample; ElevenLabs is fallback only."
    },
    {
      "key": "VOICE_FALLBACK_PROVIDER",
      "requiredPhase": "phase9e",
      "scope": "server_config",
      "cloudflareBinding": "plain_var",
      "clientExposure": "forbidden",
      "placeholder": "elevenlabs",
      "description": "Fallback voice provider used only when Fish Audio dynamic voice is unavailable."
    },
    {
      "key": "FISH_API_KEY",
      "requiredPhase": "phase9e",
      "scope": "server_secret",
      "cloudflareBinding": "secret",
      "clientExposure": "forbidden",
      "placeholder": "REPLACE_WITH_LOCAL_FISH_API_KEY",
      "description": "Fish Audio API key for Scooter cloned dynamic voice. Server-side only; store in encrypted vault / Cloudflare secret."
    },
    {
      "key": "FISH_API_BASE_URL",
      "requiredPhase": "phase9e",
      "scope": "server_config",
      "cloudflareBinding": "plain_var",
      "clientExposure": "forbidden",
      "placeholder": "https://api.fish.audio",